{"schemaVersion":"1.0.0","annotationId":"annotation-1","anchor":{"kind":"region","resourceId":"candidate-1","revision":3,"resourceHash":"aaaaaaaaaaaaaaaaaaaaaaaaaaaaaaaaaaaaaaaaaaaaaaaaaaaaaaaaaaaaaaaa","selector":"/screen/header","region":{"x":10,"y":20,"width":100,"height":40,"unit":"px"}},"reviewer":{"reviewerId":"reviewer-1","displayName":"Ada","role":"reviewer"},"createdAt":"2026-09-18T15:00:00.000Z","instruction":"Make the primary action label explicit.","annotationHash":"686b7766ffaa3b3fce7c1d9fe6337041f6b1227c42dcd3be38f7c2cd918b0748"}
